{
  "$schema": "https://json-schema.org/draft/2020-12/schema",
  "type": "array",
  "items": {
    "type": "object",
    "required": ["id", "name", "coords", "type", "notes", "links"],
    "properties": {
      "id": {"type": "string", "pattern": "^[a-z0-9-]+$"},
      "name": {"type": "string"},
      "coords": {
        "type": "array",
        "prefixItems": [
          {"type": "number", "minimum": -90, "maximum": 90},
          {"type": "number", "minimum": -180, "maximum": 180}
        ],
        "minItems": 2,
        "maxItems": 2
      },
      "type": {"type": "string", "enum": ["anchorage", "marina", "restaurant", "beach", "town"]},
      "notes": {"type": "string"},
      "links": {"type": "array", "items": {"type": "string", "format": "uri"}}
    }
  }
}
